Spotify URI,Voter ID,Created,Points Assigned,Comment,Round ID
spotify:track:4U7Mih8jHL0v5g6oksHMBm,b610d55f12f147b89502873c4b93e5ef,2025-07-08T03:22:43Z,0,Good vibey song but not a standout from this week of great submissions. Still saved though. Guess: Bobo,aa64e6f265084eb2b3c7c231f25e06f9
spotify:track:5VtB3dwGp5qOAiZumi96zE,b610d55f12f147b89502873c4b93e5ef,2025-07-08T03:22:43Z,1,Both of these are super dope. I love the originality of the submission and thus am giving 1 vote. These would both be killer in a live set. Guess: Chuck,aa64e6f265084eb2b3c7c231f25e06f9
spotify:track:67wOIdJG6ErtSqsJ6gSvnN,b610d55f12f147b89502873c4b93e5ef,2025-07-08T03:22:43Z,0,This is neat but I wanted more variety in the track. She is screaming the entire time lol. Guess: Zach,aa64e6f265084eb2b3c7c231f25e06f9
spotify:track:7dnQZxpbKsHNmtlWcRdsR4,b610d55f12f147b89502873c4b93e5ef,2025-07-08T03:22:43Z,1,Dope. Saved and gets a vote. Guess: Baker,aa64e6f265084eb2b3c7c231f25e06f9
spotify:track:7JbONdZR1a15XAflyiFp2N,b610d55f12f147b89502873c4b93e5ef,2025-07-08T03:22:43Z,0,Ehhh I like this but I don't think it's even the best rock song submitted this week. Guess: Owen,aa64e6f265084eb2b3c7c231f25e06f9
spotify:track:0AlUE5KtWmqhb7I869f6mY,8ad71d9554d24eaf877dda25758aae45,2025-07-09T04:06:38Z,1,"L Devine made my list of contenders, love this one. Peachy Keen is another banger",aa64e6f265084eb2b3c7c231f25e06f9
spotify:track:1g5BMpvXYQLW9pP6JRNjzP,8ad71d9554d24eaf877dda25758aae45,2025-07-09T04:06:38Z,0,"please stop writing these essay comments, i'm not reading them. solid pick though",aa64e6f265084eb2b3c7c231f25e06f9
spotify:track:2CTSGaCi2kpl6iVDzdnneZ,8ad71d9554d24eaf877dda25758aae45,2025-07-09T04:06:38Z,1,"10 seconds in i thought i wouldn't like it, by the end of the first listen i added the song. it's quite nice",aa64e6f265084eb2b3c7c231f25e06f9
spotify:track:2FyQlUNkoBq7D4eGyb2MN3,8ad71d9554d24eaf877dda25758aae45,2025-07-09T04:06:38Z,0,I added this song but unfortunately that wasn't enough this week for a vote,aa64e6f265084eb2b3c7c231f25e06f9
spotify:track:46PtYBXwf9KYL2TF7llg6b,8ad71d9554d24eaf877dda25758aae45,2025-07-09T04:06:38Z,1,we were 1 track away from having Derek Jeter in music league. This one does really get me going (even though i gotta say i don't love the spoken word part),aa64e6f265084eb2b3c7c231f25e06f9
spotify:track:4rXQUhTLgCh5Dk3GBHBzON,8ad71d9554d24eaf877dda25758aae45,2025-07-09T04:06:38Z,0,I don't mind it but as someone who has a ton of this genre of song in my library this one strikes me as forgettable,aa64e6f265084eb2b3c7c231f25e06f9
spotify:track:4USztpjKZRDx6XQmxWZkDN,8ad71d9554d24eaf877dda25758aae45,2025-07-09T04:06:38Z,0,This was my hardest cut,aa64e6f265084eb2b3c7c231f25e06f9
spotify:track:5VtB3dwGp5qOAiZumi96zE,8ad71d9554d24eaf877dda25758aae45,2025-07-09T04:06:38Z,0,"yes chuck, i did listen to the youtube song and not the one on the playlist. it honestly feels like a demo to me, it's 6 minutes long and i feel like if it was tightened up it could be a good 3 minute track, but as it is it gets boring",aa64e6f265084eb2b3c7c231f25e06f9
spotify:track:67wOIdJG6ErtSqsJ6gSvnN,8ad71d9554d24eaf877dda25758aae45,2025-07-09T04:06:38Z,0,ik they're close to 250k but i just think Bully is awesome and idc,aa64e6f265084eb2b3c7c231f25e06f9
spotify:track:7dnQZxpbKsHNmtlWcRdsR4,8ad71d9554d24eaf877dda25758aae45,2025-07-09T04:06:38Z,1,i'm not reading your qualifiers; stand behind you song. Especially because its quite good,aa64e6f265084eb2b3c7c231f25e06f9
spotify:track:7JbONdZR1a15XAflyiFp2N,8ad71d9554d24eaf877dda25758aae45,2025-07-09T04:06:38Z,1,you are correct this song is a taste,aa64e6f265084eb2b3c7c231f25e06f9
spotify:track:0AlUE5KtWmqhb7I869f6mY,6521770c9aeb4bffb740a9141e624077,2025-07-10T01:58:45Z,2,Okay I was not loving this at first but I think it's Zach and it grew on me a lot quite the bop. Got stuck in my head but in a good way. ,aa64e6f265084eb2b3c7c231f25e06f9
spotify:track:1g5BMpvXYQLW9pP6JRNjzP,6521770c9aeb4bffb740a9141e624077,2025-07-10T01:58:45Z,1,Sometimes you read about vishs life and you just gotta say hell yeah,aa64e6f265084eb2b3c7c231f25e06f9
spotify:track:2CTSGaCi2kpl6iVDzdnneZ,6521770c9aeb4bffb740a9141e624077,2025-07-10T01:58:45Z,0,If you don't have anything nice to say don't say anything at all. I learned that when I was child. ,aa64e6f265084eb2b3c7c231f25e06f9
spotify:track:2FyQlUNkoBq7D4eGyb2MN3,6521770c9aeb4bffb740a9141e624077,2025-07-10T01:58:45Z,1,I like this one a lot probably my second,aa64e6f265084eb2b3c7c231f25e06f9
spotify:track:46PtYBXwf9KYL2TF7llg6b,6521770c9aeb4bffb740a9141e624077,2025-07-10T01:58:45Z,1,Honestly just fucked with the beat here,aa64e6f265084eb2b3c7c231f25e06f9
spotify:track:4rXQUhTLgCh5Dk3GBHBzON,6521770c9aeb4bffb740a9141e624077,2025-07-10T01:58:45Z,0,I do agree this fucks I want to see more from her sorry this was the just not making the list,aa64e6f265084eb2b3c7c231f25e06f9
spotify:track:4U7Mih8jHL0v5g6oksHMBm,6521770c9aeb4bffb740a9141e624077,2025-07-10T01:58:45Z,0,Twas good,aa64e6f265084eb2b3c7c231f25e06f9
spotify:track:4USztpjKZRDx6XQmxWZkDN,6521770c9aeb4bffb740a9141e624077,2025-07-10T01:58:45Z,0,Good one but just really strong week,aa64e6f265084eb2b3c7c231f25e06f9
spotify:track:5VtB3dwGp5qOAiZumi96zE,6521770c9aeb4bffb740a9141e624077,2025-07-10T01:58:45Z,0,Uhhh I actually liked this even though I didn't expect to. If it was on Spotify I would add it to a study playlist but again strong week,aa64e6f265084eb2b3c7c231f25e06f9
spotify:track:67wOIdJG6ErtSqsJ6gSvnN,6521770c9aeb4bffb740a9141e624077,2025-07-10T01:58:45Z,0,Hmm I didn't love this one I don't have much else,aa64e6f265084eb2b3c7c231f25e06f9
spotify:track:7JbONdZR1a15XAflyiFp2N,6521770c9aeb4bffb740a9141e624077,2025-07-10T01:58:45Z,0,I also thought it was fine just not standing out this week,aa64e6f265084eb2b3c7c231f25e06f9
spotify:track:0AlUE5KtWmqhb7I869f6mY,2188964000cf410c8dbf4fd04eb76fed,2025-07-10T12:52:56Z,1,,aa64e6f265084eb2b3c7c231f25e06f9
spotify:track:1g5BMpvXYQLW9pP6JRNjzP,2188964000cf410c8dbf4fd04eb76fed,2025-07-10T12:52:56Z,2,,aa64e6f265084eb2b3c7c231f25e06f9
spotify:track:46PtYBXwf9KYL2TF7llg6b,2188964000cf410c8dbf4fd04eb76fed,2025-07-10T12:52:56Z,1,,aa64e6f265084eb2b3c7c231f25e06f9
spotify:track:4U7Mih8jHL0v5g6oksHMBm,2188964000cf410c8dbf4fd04eb76fed,2025-07-10T12:52:56Z,1,,aa64e6f265084eb2b3c7c231f25e06f9
spotify:track:1g5BMpvXYQLW9pP6JRNjzP,043c232c2e1040a2bc082eac10f81f12,2025-07-10T15:47:46Z,1,,aa64e6f265084eb2b3c7c231f25e06f9
spotify:track:46PtYBXwf9KYL2TF7llg6b,043c232c2e1040a2bc082eac10f81f12,2025-07-10T15:47:46Z,1,,aa64e6f265084eb2b3c7c231f25e06f9
spotify:track:4rXQUhTLgCh5Dk3GBHBzON,043c232c2e1040a2bc082eac10f81f12,2025-07-10T15:47:46Z,3,,aa64e6f265084eb2b3c7c231f25e06f9
spotify:track:2CTSGaCi2kpl6iVDzdnneZ,2514636114c2431a903f1cad7eaf72e5,2025-07-10T21:01:39Z,0,"I recognize that other people have different music tastes than I do, and that by itself does not make them worse (or better) than mine. HAVING SAID THAT...",aa64e6f265084eb2b3c7c231f25e06f9
spotify:track:0AlUE5KtWmqhb7I869f6mY,2514636114c2431a903f1cad7eaf72e5,2025-07-10T21:01:39Z,2,"I like it, but in no universe would this song usually get two votes. Unfortunately, I wasn't vibing with the other submissions, and this song manages to clear them. ",aa64e6f265084eb2b3c7c231f25e06f9
spotify:track:1g5BMpvXYQLW9pP6JRNjzP,2514636114c2431a903f1cad7eaf72e5,2025-07-10T21:01:39Z,0,"Let's put it this way: pack your bags, get out, you should be kicked out of this league. 

Because, for discovering hidden talent like this, you should be working in the best music industry in the WORLD. 

Just not any world that I live in. ",aa64e6f265084eb2b3c7c231f25e06f9
spotify:track:2FyQlUNkoBq7D4eGyb2MN3,2514636114c2431a903f1cad7eaf72e5,2025-07-10T21:01:39Z,0,"I enjoyed this. Wait, I have two saved songs from them? That's definitely why I recognized the sound. I have ""Show me the way"" and ""Do me like that"" saved. Man, I was going to give this a vote, but because I recognize this artist and had a couple of their songs saved, I can't anymore — its not obscure. I saved these songs in 2015 and 2018 so during high school. Did one of you show these to me then? Is that how I found them?",aa64e6f265084eb2b3c7c231f25e06f9
spotify:track:46PtYBXwf9KYL2TF7llg6b,2514636114c2431a903f1cad7eaf72e5,2025-07-10T21:01:39Z,0,"In conclusion, eeeh",aa64e6f265084eb2b3c7c231f25e06f9
spotify:track:4rXQUhTLgCh5Dk3GBHBzON,2514636114c2431a903f1cad7eaf72e5,2025-07-10T21:01:39Z,1,I do like this one ,aa64e6f265084eb2b3c7c231f25e06f9
spotify:track:4U7Mih8jHL0v5g6oksHMBm,2514636114c2431a903f1cad7eaf72e5,2025-07-10T21:01:39Z,0,"Tennis Courts is my other favorite song from him - givituhlisten. 

Kevin Holliday just released a new single in May and his monthly listeners has shot up by 20k

https://www.youtube.com/watch?v=9wk4ApHloHM",aa64e6f265084eb2b3c7c231f25e06f9
spotify:track:4USztpjKZRDx6XQmxWZkDN,2514636114c2431a903f1cad7eaf72e5,2025-07-10T21:01:39Z,0,"Frankly, I'm jealous of you. 

And your ability to not give a sht about what you submit. ",aa64e6f265084eb2b3c7c231f25e06f9
spotify:track:5VtB3dwGp5qOAiZumi96zE,2514636114c2431a903f1cad7eaf72e5,2025-07-10T21:01:39Z,0,"The comments are turned off on the Youtube video you linked, probably because it was getting too much hate. 

This is the only possible round where its okay to link your actual submission in the comments and use a random song as a placeholder submission. Next time it won't fly BUDDY",aa64e6f265084eb2b3c7c231f25e06f9
spotify:track:67wOIdJG6ErtSqsJ6gSvnN,2514636114c2431a903f1cad7eaf72e5,2025-07-10T21:01:39Z,0,"I have a huge problem with this song — It's that you didn't show it to me sooner. 





Because if you had, I would know how good you are at picking songs that are bad",aa64e6f265084eb2b3c7c231f25e06f9
spotify:track:7JbONdZR1a15XAflyiFp2N,2514636114c2431a903f1cad7eaf72e5,2025-07-10T21:01:39Z,2,"If this is just a taste, then I want a full LICK",aa64e6f265084eb2b3c7c231f25e06f9
spotify:track:0AlUE5KtWmqhb7I869f6mY,3b73cc44d9ce4479956467fba877a02e,2025-07-10T21:12:39Z,2,Pretty solid beats,aa64e6f265084eb2b3c7c231f25e06f9
spotify:track:4rXQUhTLgCh5Dk3GBHBzON,3b73cc44d9ce4479956467fba877a02e,2025-07-10T21:12:39Z,3,This song makes me feel a type of way,aa64e6f265084eb2b3c7c231f25e06f9
spotify:track:1g5BMpvXYQLW9pP6JRNjzP,0c04c978ff14409e9018621377b6b7e9,2025-07-12T14:39:20Z,1,maybe its because ive seen him in person but dre's got the juice.,aa64e6f265084eb2b3c7c231f25e06f9
spotify:track:2CTSGaCi2kpl6iVDzdnneZ,0c04c978ff14409e9018621377b6b7e9,2025-07-12T14:39:20Z,0,"oh fuck !
its the second listen and i forgot about this one until it came on. this is for ped*philes !",aa64e6f265084eb2b3c7c231f25e06f9
spotify:track:2FyQlUNkoBq7D4eGyb2MN3,0c04c978ff14409e9018621377b6b7e9,2025-07-12T14:39:20Z,0,any song with 'coming' in the title is good. his little falsetto reminds me of electric feel and yall know i feel travis kelce about that song.,aa64e6f265084eb2b3c7c231f25e06f9
spotify:track:46PtYBXwf9KYL2TF7llg6b,0c04c978ff14409e9018621377b6b7e9,2025-07-12T14:39:20Z,0,oh shit this one is mine. uhhhh yea ive been watching a lot of good ass movies and listening to songs with power chords in the last year or so.,aa64e6f265084eb2b3c7c231f25e06f9
spotify:track:4rXQUhTLgCh5Dk3GBHBzON,0c04c978ff14409e9018621377b6b7e9,2025-07-12T14:39:20Z,0,another extremely 2021 selection. i think this genre with a synth bass and little snappy rimshot snare is like the modern day ukulele cup song genre. i hope you know i say that with love for bedroom pop.,aa64e6f265084eb2b3c7c231f25e06f9
spotify:track:4U7Mih8jHL0v5g6oksHMBm,0c04c978ff14409e9018621377b6b7e9,2025-07-12T14:39:20Z,1,this is just a disco track but hes singing 21st century over it. im obsessed it kinda reminds me of 'the less i know the better' by tame impala too. no regrets,aa64e6f265084eb2b3c7c231f25e06f9
spotify:track:4USztpjKZRDx6XQmxWZkDN,0c04c978ff14409e9018621377b6b7e9,2025-07-12T14:39:20Z,0,"hes got a new wave voice but its like a midwest indie track which is fun. verses were better than the chorus to me, he should just stick with the low energy monotone voice i think. if you like this you might like black country new road.

i bet yall would be surprised at how many music league songs have mandolin.",aa64e6f265084eb2b3c7c231f25e06f9
spotify:track:5VtB3dwGp5qOAiZumi96zE,0c04c978ff14409e9018621377b6b7e9,2025-07-12T14:39:20Z,1,granular synthesis for SURE iykyk. this is cool but it could really use a hot girl singing over it.,aa64e6f265084eb2b3c7c231f25e06f9
spotify:track:67wOIdJG6ErtSqsJ6gSvnN,0c04c978ff14409e9018621377b6b7e9,2025-07-12T14:39:20Z,1,"i bet shes never bullied someone in her life. poser.

this is the only other song id heard besides my own and dre. good stuff no notes",aa64e6f265084eb2b3c7c231f25e06f9
spotify:track:7dnQZxpbKsHNmtlWcRdsR4,0c04c978ff14409e9018621377b6b7e9,2025-07-12T14:39:20Z,0,this song is good in its genre but kinda boring to me im sorry. his voice sounds crazy familiar but i cant figure out who he sounds like.,aa64e6f265084eb2b3c7c231f25e06f9
spotify:track:7JbONdZR1a15XAflyiFp2N,0c04c978ff14409e9018621377b6b7e9,2025-07-12T14:39:20Z,0,"haha this album cover is so funny. winnie the poohing it. 

this song sounds like an american idol performance by someone who got 6th.",aa64e6f265084eb2b3c7c231f25e06f9
spotify:track:0AlUE5KtWmqhb7I869f6mY,0c04c978ff14409e9018621377b6b7e9,2025-07-12T14:39:20Z,1,"shes so sad and alone but the song is so fun sounding. love that

this is also such a 2021 song i was listening to similar stuff.",aa64e6f265084eb2b3c7c231f25e06f9
spotify:track:0AlUE5KtWmqhb7I869f6mY,289b6ce1643d401f950a6eb514ddfd36,2025-07-12T23:12:47Z,1,Feels premature but i already think this deserves a vote.,aa64e6f265084eb2b3c7c231f25e06f9
spotify:track:2FyQlUNkoBq7D4eGyb2MN3,289b6ce1643d401f950a6eb514ddfd36,2025-07-12T23:12:47Z,1,Theres something i like about this. Something about the way the chords sound w the dudes voice,aa64e6f265084eb2b3c7c231f25e06f9
spotify:track:46PtYBXwf9KYL2TF7llg6b,289b6ce1643d401f950a6eb514ddfd36,2025-07-12T23:12:47Z,2,i voted as soon as i heard the second bar. This is what they call a good ass song.,aa64e6f265084eb2b3c7c231f25e06f9
spotify:track:4rXQUhTLgCh5Dk3GBHBzON,289b6ce1643d401f950a6eb514ddfd36,2025-07-12T23:12:47Z,1,good song,aa64e6f265084eb2b3c7c231f25e06f9
spotify:track:2CTSGaCi2kpl6iVDzdnneZ,289b6ce1643d401f950a6eb514ddfd36,2025-07-12T23:12:47Z,0,True bro that drop at 1:14 is sick.,aa64e6f265084eb2b3c7c231f25e06f9
spotify:track:46PtYBXwf9KYL2TF7llg6b,eab45a88f95d4ae893e32ca723946d60,2025-07-13T00:38:49Z,2,,aa64e6f265084eb2b3c7c231f25e06f9
spotify:track:0AlUE5KtWmqhb7I869f6mY,eab45a88f95d4ae893e32ca723946d60,2025-07-13T00:38:49Z,1,,aa64e6f265084eb2b3c7c231f25e06f9
spotify:track:1g5BMpvXYQLW9pP6JRNjzP,eab45a88f95d4ae893e32ca723946d60,2025-07-13T00:38:49Z,1,,aa64e6f265084eb2b3c7c231f25e06f9
spotify:track:4rXQUhTLgCh5Dk3GBHBzON,eab45a88f95d4ae893e32ca723946d60,2025-07-13T00:38:49Z,1,,aa64e6f265084eb2b3c7c231f25e06f9
spotify:track:0AlUE5KtWmqhb7I869f6mY,80213310c71e48b297cb1223ff34a32c,2025-07-13T01:24:31Z,0,"Maybe I’m a prude but I don’t like when artists are like yeah we were fucking. I like a little seduction, a little mystery. ",aa64e6f265084eb2b3c7c231f25e06f9
spotify:track:46PtYBXwf9KYL2TF7llg6b,80213310c71e48b297cb1223ff34a32c,2025-07-13T01:24:31Z,0,I DESPISE when artists just start trying to have a conversation in the middle of the song,aa64e6f265084eb2b3c7c231f25e06f9
spotify:track:4rXQUhTLgCh5Dk3GBHBzON,80213310c71e48b297cb1223ff34a32c,2025-07-13T01:24:31Z,0,Abby never reflects whether she is a good friend. Friendship is a two way street.,aa64e6f265084eb2b3c7c231f25e06f9
spotify:track:7dnQZxpbKsHNmtlWcRdsR4,80213310c71e48b297cb1223ff34a32c,2025-07-13T01:24:31Z,1,Shoutout himym ,aa64e6f265084eb2b3c7c231f25e06f9
spotify:track:7JbONdZR1a15XAflyiFp2N,80213310c71e48b297cb1223ff34a32c,2025-07-13T01:24:31Z,4,I was mad the first time I listened because it was slow and sad like the rest of the playlist but when I listened a second time I liked it more. Doesn’t deserve a 4 but I genuinely didn’t like anything else.,aa64e6f265084eb2b3c7c231f25e06f9
spotify:track:1g5BMpvXYQLW9pP6JRNjzP,1cd356096fa0498aa955acf21944c65d,2025-07-13T01:48:53Z,1,forgot to vote lol ,aa64e6f265084eb2b3c7c231f25e06f9
spotify:track:2CTSGaCi2kpl6iVDzdnneZ,1cd356096fa0498aa955acf21944c65d,2025-07-13T01:48:53Z,1,,aa64e6f265084eb2b3c7c231f25e06f9
spotify:track:2FyQlUNkoBq7D4eGyb2MN3,1cd356096fa0498aa955acf21944c65d,2025-07-13T01:48:53Z,1,,aa64e6f265084eb2b3c7c231f25e06f9
spotify:track:46PtYBXwf9KYL2TF7llg6b,1cd356096fa0498aa955acf21944c65d,2025-07-13T01:48:53Z,1,,aa64e6f265084eb2b3c7c231f25e06f9
spotify:track:4rXQUhTLgCh5Dk3GBHBzON,1cd356096fa0498aa955acf21944c65d,2025-07-13T01:48:53Z,1,,aa64e6f265084eb2b3c7c231f25e06f9
spotify:track:38G32c3uJeFucSYweZv4pI,6521770c9aeb4bffb740a9141e624077,2025-07-16T13:40:36Z,0,Yeah I can see why this song was submitted and I'm sure it will get votes but those votes were never going to be from me. Guess: Baker ,1935852a426d4287a3d05b1ee1309fd9
spotify:track:3nEHrvNNtgLv9rneTAYVr4,6521770c9aeb4bffb740a9141e624077,2025-07-16T13:40:36Z,0,I liked this one quite a bit. More than the other one. It still just wasn't enough to get the nod. Every other song I added and I just am not on the house music wave like that. Guess: Cooper,1935852a426d4287a3d05b1ee1309fd9
spotify:track:3yPD6CHGE1xdJBWyu6ZBKk,6521770c9aeb4bffb740a9141e624077,2025-07-16T13:40:36Z,1,Okay yeah I like this way more than the remix I had heard this maybe once and I just really enjoyed the vibes. Scratched an itch. Guess: Chuck,1935852a426d4287a3d05b1ee1309fd9
spotify:track:4JPF8Te7Jo3AuI2vKqrRUV,6521770c9aeb4bffb740a9141e624077,2025-07-16T13:40:36Z,0,God this was such a good week. I liked this song a lot too but I think maybe the really long interlude or something about it just wasn't working for me perfectly. Guess: James,1935852a426d4287a3d05b1ee1309fd9
spotify:track:5dE8s6uWRGNc1Ac7y8rULq,6521770c9aeb4bffb740a9141e624077,2025-07-16T13:40:36Z,2,Yes! Yes! Thank you! This is a song that I've heard a few times but did not know the name of. Absolutely huge to add to the collection. This shit makes me want to throw on my jacket and run out the door while making an upbeat sitcom intro in the best way. Guess: Jacob,1935852a426d4287a3d05b1ee1309fd9
spotify:track:5dUOWlWWYdAgqeXwTgbaKt,6521770c9aeb4bffb740a9141e624077,2025-07-16T13:40:36Z,0,Yeah I mean again this week was quite good. This wasn't making it because I feel like it just feels too similar to all the other music that exists right now. Breathy girl singing about relationships is so in right now. Guess: Owen,1935852a426d4287a3d05b1ee1309fd9
spotify:track:7H3ojI1BsVy0dEJENqMt1k,6521770c9aeb4bffb740a9141e624077,2025-07-16T13:40:36Z,0,I'm intrigued by who would write this description. Not that it's wrong it's just very interesting. And again good song just such a good week although personally I feel like the playlist doesn't work great due to the lack of coherence which makes sense. Guess: Zach,1935852a426d4287a3d05b1ee1309fd9
spotify:track:0fIDUXVyJ1JISqB4HP4D5H,6521770c9aeb4bffb740a9141e624077,2025-07-16T13:40:36Z,1,I considered not voting because well I've known this song forever and am convinced so has everyone else. On the other hand I fucking love this song so one vote. Guess: Michael,1935852a426d4287a3d05b1ee1309fd9
spotify:track:0oTelkAghhQaETjlp6QXt3,6521770c9aeb4bffb740a9141e624077,2025-07-16T13:40:36Z,1,Yeah okay I amend my statement to being a slut for all brass instruments. Guess: Daniel,1935852a426d4287a3d05b1ee1309fd9
spotify:track:1OQEF0LsL7KMQmBZSiUcdE,6521770c9aeb4bffb740a9141e624077,2025-07-16T13:40:36Z,0,I don't know I liked it a lot but this was tough as a round and I thought I wanted more. I really fuck with the baseline but it just wasn't getting the pass all the way from me. Maybe a bit too synth for me. Guess: Vish,1935852a426d4287a3d05b1ee1309fd9
spotify:track:2EWpa5XnAuSn0sIkSSIhYk,6521770c9aeb4bffb740a9141e624077,2025-07-16T13:40:36Z,0,I was listening to this on the way to play tennis right before this playlist came out and that's pretty wild. That said while I like this I don't think it gets the nod in tough competition. Guess: Bennie ,1935852a426d4287a3d05b1ee1309fd9
spotify:track:2EWpa5XnAuSn0sIkSSIhYk,1cd356096fa0498aa955acf21944c65d,2025-07-16T14:39:09Z,0,thats so wholesome oh my,1935852a426d4287a3d05b1ee1309fd9
spotify:track:1OQEF0LsL7KMQmBZSiUcdE,1cd356096fa0498aa955acf21944c65d,2025-07-16T14:39:09Z,0,am i a hippo crip or nah ,1935852a426d4287a3d05b1ee1309fd9
spotify:track:38G32c3uJeFucSYweZv4pI,1cd356096fa0498aa955acf21944c65d,2025-07-16T14:39:09Z,1,radio edit is crazy bruv but i do be fw this song ,1935852a426d4287a3d05b1ee1309fd9
spotify:track:3nEHrvNNtgLv9rneTAYVr4,1cd356096fa0498aa955acf21944c65d,2025-07-16T14:39:09Z,1,unfortunatley my second favorite swedish house mafia song on the playlist ,1935852a426d4287a3d05b1ee1309fd9
spotify:track:3yPD6CHGE1xdJBWyu6ZBKk,1cd356096fa0498aa955acf21944c65d,2025-07-16T14:39:09Z,0,i really want to give this song a vote but its leaving something to be desired for me ,1935852a426d4287a3d05b1ee1309fd9
spotify:track:4JPF8Te7Jo3AuI2vKqrRUV,1cd356096fa0498aa955acf21944c65d,2025-07-16T14:39:09Z,2,"this song is fire and theres no way that anyone but owen submitted it, right ?",1935852a426d4287a3d05b1ee1309fd9
spotify:track:5dE8s6uWRGNc1Ac7y8rULq,1cd356096fa0498aa955acf21944c65d,2025-07-16T14:39:09Z,0,wpm,1935852a426d4287a3d05b1ee1309fd9
spotify:track:5dUOWlWWYdAgqeXwTgbaKt,1cd356096fa0498aa955acf21944c65d,2025-07-16T14:39:09Z,1,why i think the first 8 count was gonna be 9-5 by dolly parton ,1935852a426d4287a3d05b1ee1309fd9
spotify:track:7H3ojI1BsVy0dEJENqMt1k,1cd356096fa0498aa955acf21944c65d,2025-07-16T14:39:09Z,0,"vish type song with a zach type caption.

sorry but i gave my last vote away ",1935852a426d4287a3d05b1ee1309fd9
spotify:track:00KiXBZT9vf1XhcqkFrzug,1cd356096fa0498aa955acf21944c65d,2025-07-16T14:39:09Z,0,this sounds like church music ,1935852a426d4287a3d05b1ee1309fd9
spotify:track:0fIDUXVyJ1JISqB4HP4D5H,1cd356096fa0498aa955acf21944c65d,2025-07-16T14:39:09Z,0,this song sounds like something that i would hear on NHL 2k12,1935852a426d4287a3d05b1ee1309fd9
spotify:track:0oTelkAghhQaETjlp6QXt3,1cd356096fa0498aa955acf21944c65d,2025-07-16T14:39:09Z,0,rural gerogia when i was 11 type shit ,1935852a426d4287a3d05b1ee1309fd9
spotify:track:0oTelkAghhQaETjlp6QXt3,b610d55f12f147b89502873c4b93e5ef,2025-07-16T19:14:19Z,2,I discovered this song a few years ago but totally forgot about it!! Thank you so much for bringing this back into my purview. 10/10 guilty pleasure track. Guess: Jecub,1935852a426d4287a3d05b1ee1309fd9
spotify:track:7H3ojI1BsVy0dEJENqMt1k,b610d55f12f147b89502873c4b93e5ef,2025-07-16T19:14:19Z,0,Yeah this is good but it was a competitive week this week. Guess: James,1935852a426d4287a3d05b1ee1309fd9
spotify:track:5dUOWlWWYdAgqeXwTgbaKt,b610d55f12f147b89502873c4b93e5ef,2025-07-16T19:14:19Z,1,Im not sure where I found Chloe a few months ago (probably Owen) but I’ve kept finding more bangers by her. This is one of those bangers. Guess: Owen,1935852a426d4287a3d05b1ee1309fd9
spotify:track:5dE8s6uWRGNc1Ac7y8rULq,b610d55f12f147b89502873c4b93e5ef,2025-07-16T19:14:19Z,1,I’m been listening to this since I was little and I get goosebumps every time I hear it. Logical Song -> this -> Breakfast in America is such a power lineup on the album. Guess: Bobo,1935852a426d4287a3d05b1ee1309fd9
spotify:track:4JPF8Te7Jo3AuI2vKqrRUV,b610d55f12f147b89502873c4b93e5ef,2025-07-16T19:14:19Z,1,Just a cool song! I love the piano and the way she plays with her voice. Guess: Chuck,1935852a426d4287a3d05b1ee1309fd9
spotify:track:3nEHrvNNtgLv9rneTAYVr4,b610d55f12f147b89502873c4b93e5ef,2025-07-16T19:14:19Z,0,Zachhhhhhhhh I really do like this track but I think it’s time for some new tunes,1935852a426d4287a3d05b1ee1309fd9
spotify:track:38G32c3uJeFucSYweZv4pI,b610d55f12f147b89502873c4b93e5ef,2025-07-16T19:14:19Z,0,Solid hype song but the worse of the two SHM songs submitted this week so unfortunately no votes. Gotta respect t the selection tho since we don’t have many EDM enthusiasts here. Guess: Michael,1935852a426d4287a3d05b1ee1309fd9
spotify:track:2EWpa5XnAuSn0sIkSSIhYk,b610d55f12f147b89502873c4b93e5ef,2025-07-16T19:14:19Z,0,I wanna hear this on a boat. Guess: Vish,1935852a426d4287a3d05b1ee1309fd9
spotify:track:00KiXBZT9vf1XhcqkFrzug,b610d55f12f147b89502873c4b93e5ef,2025-07-16T19:14:19Z,0,This so good but not really that memorable to me. Guess: Baker,1935852a426d4287a3d05b1ee1309fd9
spotify:track:0fIDUXVyJ1JISqB4HP4D5H,b610d55f12f147b89502873c4b93e5ef,2025-07-16T19:14:19Z,0,Another one that’s good but kinda generic to me. Reminds me of U2. Guess: Bennie,1935852a426d4287a3d05b1ee1309fd9
spotify:track:1OQEF0LsL7KMQmBZSiUcdE,b610d55f12f147b89502873c4b93e5ef,2025-07-16T19:14:19Z,0,There’s some cool stuff going on here by the alt-y guitar is an instant turn off for me. I probably need to expand my horizons though. Guess: Matthew,1935852a426d4287a3d05b1ee1309fd9
spotify:track:5dUOWlWWYdAgqeXwTgbaKt,3b73cc44d9ce4479956467fba877a02e,2025-07-17T03:34:51Z,3,I like the melody it’s catchy ,1935852a426d4287a3d05b1ee1309fd9
spotify:track:5dE8s6uWRGNc1Ac7y8rULq,3b73cc44d9ce4479956467fba877a02e,2025-07-17T03:34:51Z,2,It’s got that vibe,1935852a426d4287a3d05b1ee1309fd9
spotify:track:3nEHrvNNtgLv9rneTAYVr4,2188964000cf410c8dbf4fd04eb76fed,2025-07-17T14:03:41Z,1,,1935852a426d4287a3d05b1ee1309fd9
spotify:track:5dUOWlWWYdAgqeXwTgbaKt,2188964000cf410c8dbf4fd04eb76fed,2025-07-17T14:03:41Z,2,,1935852a426d4287a3d05b1ee1309fd9
spotify:track:0oTelkAghhQaETjlp6QXt3,2188964000cf410c8dbf4fd04eb76fed,2025-07-17T14:03:41Z,1,,1935852a426d4287a3d05b1ee1309fd9
spotify:track:2EWpa5XnAuSn0sIkSSIhYk,2188964000cf410c8dbf4fd04eb76fed,2025-07-17T14:03:41Z,1,,1935852a426d4287a3d05b1ee1309fd9
